{
  "schema_version": 1,
  "snapshot_id": "20261023-1634",
  "countries": [
    "DEU",
    "FRA",
    "ITA",
    "ESP"
  ],
  "series": [
    {
      "concept_id": "policy_rate",
      "role": "endogenous",
      "transform": "level",
      "transform_params": {}
    },
    {
      "concept_id": "gdp_real",
      "role": "endogenous",
      "transform": "log",
      "transform_params": {}
    },
    {
      "concept_id": "cpi",
      "role": "response",
      "transform": "log",
      "transform_params": {}
    },
    {
      "concept_id": "unemp",
      "role": "endogenous",
      "transform": "level",
      "transform_params": {}
    },
    {
      "concept_id": "oil_brent",
      "role": "exogenous",
      "transform": "log",
      "transform_params": {}
    },
    {
      "concept_id": "commod_idx",
      "role": "exogenous",
      "transform": "yoy_pct",
      "transform_params": {}
    },
    {
      "concept_id": "identified_impulse",
      "role": "shock",
      "transform": "level",
      "transform_params": {}
    }
  ],
  "frequency": "Q",
  "aggregation": {
    "policy_rate": "mean",
    "gdp_real": "mean",
    "cpi": "mean",
    "unemp": "mean",
    "oil_brent": "mean",
    "commod_idx": "mean",
    "identified_impulse": "mean"
  },
  "sample": {
    "start": "1999-Q1",
    "end": "latest"
  },
  "special_periods": {
    "covid": "dummy",
    "covid_window": {
      "start": "2020-Q1",
      "end": "2020-Q3"
    },
    "elb_threshold": 0.25
  },
  "model": {
    "id": "panel.lp",
    "params": {
      "country_window": "common",
      "first_stage": {
        "schema_version": 1,
        "snapshot_id": "20261023-1634",
        "countries": [
          "EA"
        ],
        "series": [
          {
            "concept_id": "policy_rate",
            "role": "shock",
            "transform": "level",
            "transform_params": {}
          },
          {
            "concept_id": "gdp_real",
            "role": "endogenous",
            "transform": "qoq_saar",
            "transform_params": {}
          },
          {
            "concept_id": "cpi",
            "role": "endogenous",
            "transform": "qoq_saar",
            "transform_params": {}
          },
          {
            "concept_id": "unemp",
            "role": "endogenous",
            "transform": "level",
            "transform_params": {}
          },
          {
            "concept_id": "oil_brent",
            "role": "exogenous",
            "transform": "log",
            "transform_params": {}
          },
          {
            "concept_id": "commod_idx",
            "role": "exogenous",
            "transform": "yoy_pct",
            "transform_params": {}
          }
        ],
        "frequency": "Q",
        "aggregation": {
          "policy_rate": "mean",
          "gdp_real": "mean",
          "cpi": "mean",
          "unemp": "mean",
          "oil_brent": "mean",
          "commod_idx": "mean"
        },
        "sample": {
          "start": "1999-Q1",
          "end": "latest"
        },
        "special_periods": {
          "covid": "dummy",
          "covid_window": {
            "start": "2020-Q1",
            "end": "2020-Q3"
          },
          "elb_threshold": 0.25
        },
        "model": {
          "id": "ident.external_series",
          "params": {
            "lags": 2,
            "trend": "c",
            "lag_selection": "fixed",
            "maxlags": 4,
            "exclude_window": {}
          }
        },
        "identification": {
          "id": "recursive",
          "params": {
            "order": [
              "gdp_real",
              "cpi",
              "unemp",
              "policy_rate"
            ]
          }
        },
        "outputs": {
          "confidence": 0.95,
          "irf": {
            "horizon": 12,
            "bands": 0.68,
            "shock_size": 1,
            "method": "bootstrap",
            "draws": 200,
            "shock_mode": "one_sd"
          }
        },
        "comparison": {
          "enabled": false,
          "identifications": [],
          "methods": [],
          "scenarios": []
        },
        "seed": 20261021
      },
      "horizon": 20,
      "lags": 2,
      "lag_augmented": true,
      "covariance": "Driscoll-Kraay",
      "response_mode": "cumulative_log",
      "lag_difference_scales": {
        "cpi": 400,
        "gdp_real": 400
      },
      "sample_mode": "common",
      "seasonal": false,
      "shock_size": 1,
      "growth_scale": 1,
      "template_id": "same_ecb_shock_pooled",
      "first_stage_source": "ecb_dfr",
      "effects": "country",
      "shock_type": "common"
    }
  },
  "identification": null,
  "outputs": {
    "confidence": 0.95
  },
  "comparison": {
    "enabled": false,
    "identifications": [],
    "methods": [],
    "scenarios": []
  },
  "seed": 20261021
}
